{
  "fixture_id": "api_authz_fixture_v1",
  "classification": "INTERNAL_ONLY",
  "target_boundary": "synthetic_local_fixture_only",
  "actors": [
    {
      "id": "actor_a",
      "label": "Synthetic owner actor",
      "synthetic": true
    },
    {
      "id": "actor_b",
      "label": "Synthetic non-owner actor",
      "synthetic": true
    }
  ],
  "objects": [
    {
      "id": "object_a",
      "owner_actor_id": "actor_a",
      "synthetic": true
    }
  ]
}
